Rating,Review Title,Review Text
1,It gets worse and worse,"If this is what life is going to be with online buying then god help us.It really look like these retailers ran out of revenue during the pandemic and now are trying to, distortantly and dishonestly, get it back. You place your order, pay for it and then never receive it. When you query it your given the most stupid excuse that these retailers are now monotonously using with every single customer. You then get offered a refund which you may have to wait for months to get back if you luck. If this is not a way of illegally generating money, I don't know what to call it."
1,Incompetent,"As others have said gap is crap. Cancelled two orders for no reason, and have yet to refund me.. This happened in October yet 8 weeks later i still do not have my money, constant emails and promises of 7 working days, followed by phone calls to ignorant Yank customer services I am going to have to go through the fraud route with the credit card company because they keep saying its sorted and it isn't! Like dealing with a bunch of customer service reps with severe disabilities. Leave Gap in the 90s because not only will they not deliver they will also keep your money."
1,2 MONTHS FOR A REFUND!,"They received 2 returns from me on the 10/05, only got a confirmation of receipt today for 1?The email confirmation also states the following:If you paid with a credit card, your credit should appear on your statement in one to two billing cycles.Really awful and unacceptable."
1,Extremely disappointing,Extremely disappointing. It's 6 weeks and I am still waiting to receive delivery ! for items I bought on Gap.eu website. Costumer service is useless. Despite ongoing global situation other online e-stores still manage to provide a good and timely delivery service. In the future I will consider other options on the market for my e-shoppping . I do not recommend Gap.
5,I never ever have problem with Gap,"I never ever have problem with Gap. Smooth delivery, no faults or incorrect items. Easily can get help from customer service if needed. Always quick refund if I have to return. Even during the lockdown they were efficient and professional. Highly recommended."
1,Do not buy on line from this company,"I recently bought a hoody for my grandsons birthday which is 14 May.  I ordered it on 26th April and it took a few days to arrive.  It was given to him yesterday and found to be far too big. I phoned to arrange a return and exchange.  I was told it was outside the Gap 14 days return policy so no refund or exchange  could be made, however, they were happy to place an order for a smaller size.  I pointed out that it took a few days to arrive but that cut no ice.  I will never shop at Gap again and advise everyone else to consider buying from an honest and fair supplier for their requirements"
5,I nearly didn't ordered from Gap,"I nearly didn't ordered from Gap after reading the reviews on here but there were a few things I wanted to buy, so took the plunge. I ordered 10 items in all with standard delivery, 6 arrived the next day and the remaining 4 on the following day. The only glitch was a pair of jeans were delivered instead of a jumper. I needed a longer length in most items, so 8 items were returned. I have received the refund for both parts of the order in less than 2 weeks after I returned them with Royal Mail. Excellent service and the next order (longer lengths) arrived the next day as well."
2,Waited almost 9 weeks for a refund.,"Sent for a pair of jeans online which didn't fit, so returned them via Royal Mail the next day. Tracking confirms that Gap received my return on 20th March. Having not received my refund 6 weeks later, I called customer services who confirmed receipt but said that refunds often take at least 6 weeks! I had still not received the refund a further 2 weeks later, so called again. This time I was told I would receive an immediate refund but when I asked why it had taken so long, the Customer Service Assistant declined to answer.  I eventually received my refund a week later.  How can they justify keeping my money for so long? Don't buy online from Gap unless you can navigate their strange sizing or can afford for them to keep your money for months and only return it if you chase them up!"
1,Terrible service,"Terrible service, parcel never arrived.Courier said he tried to drop it off, but I was on all day. I never received a calling card. I arranged another day off of work, stayed in that day and apparently it never even left the depot on that day. Gap neither apologised, just offered a refund after I got yodel to send it back. I wouldn't buy from gap again, just not worth the hassle."
5,excellent,I was a bit worried about the poor reviews… but I triedmy first order… two items just wanted to see what to expect… got free delivery (you get it when you sped over £25) and it came within 3 days… the quality of the clothes for the money was excellent so I ordered moresecond order placed 20/4 8pm much more items… free delivery again and it was delivered 23/4 in the morning… no problems at allPS. the t-shirts are fantastic!!!
1,Sad news for Gap joining the Next platform,"Sad news for Gap. It went the same way as Reiss did when it joined the bottom by becoming part of the Next platform. The new Gap website is absolutely hopeless compared to what it was before Next got involved. It looks like a bucket shop website, most of the items are no longer there - not even if you search for the well-known names such as Gap Body. Shame but at least it means one less place to shop so hopefully save more money. Bye bye Gap, sorry Next."
5,Great job Gap online team,"Great job Gap online teamI am a simple customer whose view won't be heard but its worth to thank the online Gap team for the excellent quality of the products, excellent service, excellent delivery. I had my order delivered today and i feel more than happy."
1,Terrible experience,They use Yodel as they delivery service so parcel never delivered. No help from GAP customer service. They did not even feel like doing anything about the issue so basically I lost time dealing with customer services and money for the item I never received. Feel cheated.
1,Rude staff…,I went to collect my parcel from Stratford  Westfield store. The lady at reception was rude. I gave her my order number but she said she need barcode. I did not receive any barcode so I had to cancel the order. Very disappointed. Never shop from gap
1,What's going on GAP?!,"We have bought many items from GAP - both instore and online.  Recently I placed an order for some jeans for my daughter - and that's the last we've heard from GAP.  There has been no communication about the order, shipment etc. and when I checked online my order has been cancelled.  I've since been trying to reach GAP by email and phone - you've guessed it, no luck at all.  For every option on the phoneline, I just get cut off.  What's going on GAP?!  So disappointing that your stores have closed, but equally that your customer service is no non-existent..."
5,First class,Use Gap on line regularlyExcellent quality and some real bargains on sale siteFast efficient delivery and very easy returnsCan't praise highly enough
5,I've been GAP client for the last 25…,"I've been GAP client for the last 25 years. I just love their stuff though I do find that full price it's expensive, maybe a bit too expensive. I've been shopping there for baby and kid clothes for all my nephews and nieces, any excuse to go to kids department really:) I read that they are closing down in Europe soon and that's a shame. I'll miss my stuff."
5,Excellent service,"Purchased online due to shops being closed for Virus. I opted for the free delivery and it arrived less than 24 hours later. I had expected it to take a few days, so was very pleased. My order was exactly as described and it fit perfectly. I like GAP because the sizes are true."
1,Gaps website is terrible why are the no…,Gaps website is terrible why are the no sizes available in chinos. I don't buy anything from there anymore the quality is terrible. Gant for mid to high price are better quality or sometimes I just go to h&m
1,Joke for online company,"delivery takes 10 working days in age of next day amazon prime. No email on shipment or delivery. Returns post delivery to their warehouse takes 15 days for refund. Joke, seriously avoid."
1,Gap UK is just depressing now,"I used to love the Gap - always a sure bet if I needed jeans, a jacket, belt, knickers, bra, pjs, jumper, workout gear, etc. Prices were good and the deals that showed up in my email made it better. I enjoyed 'window shopping' the website and usually bought whenever they had a sale. As things wound down with the move to Next, no sizes were ever available, and the items that I loved disappeared - colourful knickers, soft bras, belts, bags, fun shoes, socks, never to be seen again. The new website is, quite frankly, depressing. Completely joyless and super cheap-looking with a thumbnail that can be enlarged to a postage stamp with one strangely-posed view of the item. Still hardly any sizes available and everything looks so cheap, like total sweatshop. Delivery and returns are way too much trouble now with closure of all the shops. Other than one pair of joggers that run very short (that I kept due to impossibility of returns), I've not bought anything in ages and am unsubscribing from their emails.  I don't even want to hear from them. Too depressing."
1,Gap sent a product I haven't ordered…,Gap sent a product I haven't ordered instead of the product I ordered and paid for. I tried calling but the customer service line isn't working. Every option you press just disconnects the call! I tried emailing and 5 days later still no response! When I chased it they told me send the wrong product through their returns and order the product again! Absolute joke! Never ordering from Gap again!!!!
1,100-Day Refunds: Beware,"Ordered 2 identical pairs of jeans. Swift delivery but the warehouse sent 2 completely different pairs of jeans. Phoned up to ask for a replacement for the mistake GAP made. Was told I needed to pay to have another pair sent out and I would then send the other pair back and wait a refund which can take anything up to 100 days. Refund arrived THREE WEEKS after sending back jeans due to the warehouse packing the incorrect items. In 2018, this is frankly appalling and seems to purely so GAP can hold on to your money longer and make interest on it."
1,"Very slow delivery service, I expected much better from GAP. Order cancelled without my consent.","Very slow delivery service, the order was placed 3 days ago and I'm still awaiting despatch of the items. Delivery is estimated between 3 and 5 working days. Considering today is the 3rd working day and it still hasn't been despatched, I'll be very surprised if it arrived within the 5 working days advertised. I expected a great deal better from such a well known brand as GAP. Very very disappointed customerUpdate - I've had no follow up from the review and having checked the order status today, it has been cancelled without my consent. Having questioned this previously with GAP (as I was clearly able to see the items were out of stock), I was assured that I would receive my order by the 5 working days) - how do I make a formal complaint against GAP!!??"
5,Excellent Customer Service!,"I'm so impressed with GAP UK. During the busy Christmas / Lockdown period, I made an error and returned some items from a different company to the Gap Returns address. I contacted customer services and they assured me they would put a note on my order and when the returns team got to my parcel they would return it. I really didn't think I'd get the items back. It was such a busy period and I just accepted to lose out on about £100. Then a couple of weeks later I received all the lost items, all newly packaged and delivered back to me.I was so happy and grateful for them to return the items. Such great customer service! I would highly recommend this company."
1,Refusing to refund as legally required,"I returned my order on 16/05 and they received it back in their warehouse on 18/05. After a week of waiting patiently and no contact/refund, I contacted them to ask where my refund is. They told me I have to wait until 7 June (3 weeks!) before chasing my refund, which is not only unreasonable but unlawful. I pointed out that retailers legally have 14 days from the date it was received back to process a refund to the customer. The customer service agent refused to discuss the matter further and terminated our chat.I certainly won't be buying again - Not only was the attitude of the service agent disgusting, but the clothes are appalling quality too.EDIT: I've now filed a chargeback - Enjoy!"
1,Rubbish customer service,"I bought a number of items online on Sunday, and only noticed several hours later that although the billing address was correct, the system had picked up an old address for delivery. I therefore emailed customer services at 7.21am - before processing had even started, and also kept phoning until I was able to speak to someone. But despite having been told that Hermes would be given the correct address, the parcel has been delivered to the wrong address, and was supposedly signed for by the household. I appreciate that I probably should have spotted the error before pressing the order button, but it's ridiculous that the error couldn't be put right. Not the first time I have had problems with Gap / Hermes. Won't be buying from Gap again."
5,Very happy to shop with Gap,"Very happy to shop with Gap! Excellent quality,  fast delivery and easy returns! I always buy clothes for my son, he is allergic to many materials, but Gap quality is very good for his skin! Thank you!"
1,Refunds take too long,"Refunds for returns are simply too long for it to be worth buying online to try on at home. I got a refund on the 23rd of December for a return that was received by Gap on the 9th of December. Still waiting for a refund for a return that they received on the 15th. I have no issues with the quality of the clothes, but I won't be buying from Gap again unless I can go to a store."
1,Was sent wrong item & Gap won't resend correct item,Loved shopping in gap when they had a store in Livingston. Since they have closed all Scottish shops was trying to avoid using them as I hate online shopping & the issues it bring with returns etc.  I did however give in & put in an online order which was sent to me with the wrong item. I contacted customer service to tell them of their mistake & ask for the correct item to be sent ASAP & I will return the item i didnt order however they are unwilling to do this. I need to re buy the product (at a higher price) send the incorrect item back & they will then send me my money back which to me is ridiculous considering the error was made by them in the first place.
1,Still no items.,"Ordered over a week ago, they use Yodel as a delivery service and cannot cancel an order that Yodel have clearly lost. So I now have no items and around £80 down... fun times. Will NEVER use GAP again unless they use a better delivery service."
1,No tags and condoms in the pocket!,"I ordered jacket from Gap online,received it promptly by Hermes courier,but once I open the package to try it on I found the item without tags,obviously somebody returned the item which I assume was worn as there was condoms in the pocket!This was the first and last time I'll order from them."
1,I only gave it 1 star so I could write…,I only gave it 1 star so I could write a review about Gaps poor customer service as it is appalling if it goes into receivership I wouldn't be surprised. I went to the Westfield Store White City to see if it had an item in stock but they did not do I asked about click and collect and was told it would take 5 weeks. So I contact Customer Service who are no help at all and tell me they don't know how long it takes and that should phone other Gap stores myself to see if they have issues receiving orders really
1,Refund?,"On December 28th 2021, I returned a Christmas gift that was the wrong size, in its original packaging,and with all the relevant paperwork. I used the returns process as listed on the website. Since then, nothing. No confirmation of receipt, and certainly no refund. As it happens, I returned another parcel for the same reason to a different store at the same time, and have already had my refund. If other stores can do this efficiently at such a busy time, why is it so difficult for Gap?I emailed yesterday for further information, but still no reply. Come on Gap. Look after your customers.14:16Email received from Gap. I have to allow 15 to 20 days for a refund to be processed. Thanks for the info... Now please keep in touch."
1,Buy In-Store instead of Ordering Online,"I love GAP and their clothes but dear me, their deliveries and shipments are borderline atrocious. They still continue to use trashy parcel couriers like the thieving Hermes and Yodel. Lost my package after it arrived in Hermes' depot. How could you lose a package??? Customer Service was helpful and refunded the purchase. Goodness me GAP, please change couriers to Royal Mail or DPD or someone else other than Hermes and Yodel. How could you still operate with them if they continue to provide shoddy services to customers, even ones who use it for personal use.This experience really put me off from ordering from your company online ever."
1,Very poor service.,Ordered chinos but received a shirt with advice note detailing chinos ordered. I sent back the shirt and under comments detailed what had happened and asked for chinos I had ordered. I heard nothing for 12 days and had to telephone to ask for progress. I was told they had returned money to my account. I was told to re-order if I wanted chinos. Throughout there was no communication and no apology. I will not use the online service again.
1,What happened to Gap,"What happened to Gap? Used to be my favourite shop, but now when Next took over customer service is terrible. Also they are using Hermes/Evri as delivery company. If I knew before I paid for it I would never order it in first place. My order was left at the front door (by the pic I received in email). I was at work when order was delivered, the parcel wasn't there when I got home! Its been over a week now, and haven't heard from Gap, so no clothes I have paid for or refund!"
5,Amazing Value and Service!,I have done a few orders with Gap recently and have been pleasantly surprised with the quality of the items and speed of delivery. I also managed to grab some absolute bargains in the sale and all the sizes fit me perfectly. 5* for me.
1,Poor service and outdated terms and conditions,"Ordered a pair of jeans in their sale, paid £4 postage.When they arrived the jeans were 4 sizes smaller and the ones I wanted were out of stock. Had to drive 5 miles to drop them off at a yodel pick up point. I then received an email to say that the cost of the jeans only would be refunded after contacting customer services who pointed out that their terms and conditions excluded refunding postage but on this occasion I would receive a refund.can I just point out to GAP that I was the person who received the wrong item and therefore am entitled to a full refund for wasting my time. After their announcement today about becoming completely online I would suggest they up their customer service and terms and conditions rather than blame the customer for their mistake"
1,Do not buy from Gap,"Do not buy from Gap, items are poor quality and over priced. Colours run from clothes with one wash and their customer service is shocking. Hopefully this is will the next business to go bust and make way for a company who shows some care for its customers."
5,Past orders have been received very…,"Past orders have been received very quickly. Made another order today and when a discount did not apply to my order as it was supposed to, the webchat lady amended the order in just a few seconds to the correct amount.This will be my go-to for jeans from now on."
1,"Avoid the headache, don't shop at Gap","I have not bought anything from Gap since I was in my 20's and I have never used their online service which is atrocious!I bought a pair of jeans and returned it the day after it arrived using their prescribed method. That was over 2 weeks ago and to be honest, I forgot all about it. Today, after being reminded about the transaction, I tried to find out what happened to my refund.The website is useless as one of the emails provided returned a message saying that the email was not in existence.I tried calling and I selected the numbers to speak about returns but all that does is terminate the call. I tried several times.Now, I have no idea how to contact them or how to get my money back Avoid the headache, don't shop at Gap."
1,I can't stand gap and the way how they…,I can't stand gap and the way how they deal with returning items. I have bought numerous things from gap which I needed to change and I was unable to change it because I was told it had to be changed at a gap outlet. To make matters worst all there gap outlets are far. I'm actually glad they are closing. It's just the inconvenience they cause you when returning.
1,In store manager,"In store manager - Gregory @ Gracechurch store - was rude to two customers that I could see. Very awkward standing in the queue waiting to pay, when he dispatched two customers trying to return faulty products. Leaves a very bad impression of the store, and the brand."
3,Not impressed with their masks.,"I made an order for some Jeans and shirts and ordered two sets of the masks they had on offer. Described as 'adult masks with wire in the nose bridge' these turned out to be of a size suitable for a 7 to 10 year old and the 'wire' had no flexibility or ability to it to hold any shape. They also felt very thin. I feel its a little irresponsible for company's to be selling things like this which are so unfit for purpose in the current environment. Also, annoyingly, such items cannot be returned so they ended up thrown away.The one Item I did return I had to chase and chase, first they said contact them after 30 days, then 30 working days and then an extra 14 days and then they just asked me what I returned and did refund that. While the tracking did show the order retuned to them within three days I guess they had lost it in their warehouse or something.To be fair to them they did respond to emails in an efficient manner and eventually refund for the one item returned. It wouldn't put me of ordering from them again but I'll stick to traditional clothing items."
1,I bought a couple of men's winter hats…,"I bought a couple of men's winter hats online checked out and paid, was then sent confirmation email with 4 v neck t-shirts and larger payment amount, called and cancelled , however they still sent me the delivery and charged me. Overall a terrible and weird online shopping experience where clearly something went wrong on their end and I am now left trying to return summer t-shirts !"
1,We wasted £143 on GAP's website,"We wasted £143 on GAP's website. Go and buy yourself a t-shirt from primark, literally no difference. At least you wouldn't have the feeling of being ripped off. Also, GAP wouldn't let you put reviews on items on their page. So we can tell people not to buy"
1,I have given up with Gap,"I have given up with Gap. I ordered black jeans, they sent blue ones. I then have to waste my time arranging collection for a product I did not even order. This is just lazy. When a business moves online, you do expect that they will be able to work as an online business. This is amateurish. I won't bother again."
1,Totally robbers.,Totally robbers.Gap outlet in Livingston sales on %30 . Plus additional %20 off if download their app at that time. Should be be totally %50 off .But they charged me full amount %0.I just checked the receipt & complaint to them. Send the photos of receipt.Check ur receipt u might overpaid as well!!!
1,Poor customer service at Gap outlet,"Poor customer service at Gap outlet, items on rails with 50% off signs. When items were taken to the till to purchase the items were not 50% and staff said we should look at the small print dispite the same items being on several rails with the same sign. Very miss leading."
5,I couldn't fault the service I've had…,I couldn't fault the service I've had over the last couple of weeks. I placed three separate orders on different days and each one came the next day.
1,I really like Gap but…,"I used to really like Gap but having waited over 48 hours for a large online order to ship I gave up. There was no way of cancelling online so I spoke to a customer rep. She said she would ""start the process"" and I should get an email in about 3 days (!!) and that any refund would take two weeks. Unbelievable. Why Gap can't ship faster and why they then don't refund immediately is a mystery. I suspect they will soon be out of business if this is their approach to online shopping. A shame as I like the clothes."
2,Awful customer returns!!!!!,"Ordered some men's shorts and returned them as a poor fit. Sent them back 48 hr Royal Mail. After a couple of emails and almost 2x weeks gap sent me an email saying they have received my return and will refund in a couple of billing cycles ... in other words from postage to refund a couple of months!!! Absolutely rubbish, what if Amazon did the same? It doesn't 3 days till my last refund in the bank cleared!! Terrible way to do business. GAP sort it out it's silly and will only help you close more stores!!"
