Rating,Review Title,Review Text
1,I bought two items from the vip event…,"I bought two items from the vip event for my son from Gap Canary Wharf a few days ago. I wish I didn't. I buy most of my son's wardrobe from Gap but not anymore. Your staff is so rude attitude. The cashier seemed as if she couldn't be bothered to serve and she wanted to get over and done with. First i was overcharged by £10+ by the cashier. She was in a rush for no reason. There was one person behind me in the queue. I felt something was wrong so I checked the receipt and I queued again to tell her that she scanned the expensive item twice. Very quick and the most insincere apology. It felt like she was annoyed with me for bringing it up. Doing a few scans and then pretty much looking at me as if I should leave now. I clearly wanted to double check my receipt but she told me I refunded you £10 twice. So basically asked me to move by rolling her eyes so she could start dealing with the next client. It felt like something was wrong again. I then rechecked the receipt and realised i was not given the %5 off the app discount. I waited for her to finish her business and told her and she rolled her eyes again and asked me to cover at which point I was very annoyed. Behaving as if she doing me a favour is not an attitude that I was going to take. I said I didn't want it and left. Then I thought well why do I buy so much from a company that has such client service? A few days later I returned the item. On that day, I came across this lady again and she was arguing with another member of staff."
1,Can't cancel order,"Can't cancel order, no contact. Phone hangs up when I try calling."
1,they use yodal for deliveries which are…,"they use yodal for deliveries which are pathetic always down never delivers , gap should check yodal reviews which is below 1 star and should change their deluvery company olease its a request"
2,Taken payment for clothes they do not…,"Taken payment for clothes they do not have, order cancelled."
1,Absolutely appalling customer service,"Absolutely appalling customer service! I wouldn't bother, shop somewhere else !"
1,The worst customer service ever.,The worst customer service ever.Staff totally rude for no reason
4,Good service,"Good service, timely delivery and the product quality is quite consistent"
5,Very Helpful enjoy working there,
1,14 business days for a refund.....,14 business days for a refund...... absolute joke
1,GAP Kingston upon Thames,"GAP Denim Jeans feeback for Kingston Store (Sean):I always purchase my jeans from GAP, this the second time my jeans has worn off, I went to GAP store based in Kingston upon Thames, the store supervisor named ""Sean"" refused to exchange the jeans and said that this jeans has been used and she would not replace it, she was extremely rude that we are not supposed to replace any items once its been used, I told her that when I was purchasing this jeans, I had explained to her colleague the problem I face with jeans and she assure me that if next time this happens, then keep the receipt safe and they will replace the worn jeans, this is so frustating that the customer service of GAP has fallen to such a low level and another thing is the quality of the stretch cloth which get worn out with normal use. I have decided that I would never buy my clothes from GAP as the above experience and also advise my friends & family to avoid buying from GAP as per this untrustworthy experience."
5,Greta experience- everything arrive in…,Greta experience- everything arrive in a quick time period expected
5,Great customer service,"Great customer service, quick to respond to delayed delivery"
5,I love t-shirts from GAP.All went well …,"I love t-shirts from GAP.All went well  , quick delivery."
5,I had amazing expirience with gap eu…,I had amazing expirience with gap eu customer service
5,Brilliant discounts on the website,
5,Outstanding service and looks after…,Outstanding service and looks after their customers
5,Great shop in Sevenoaks.,
4,Good customer service,Good customer service and great promotion offers
1,I received the wrong product twice,
1,Dogsh!t customer service.,
5,Got some sick jeans,
1,Disappointed,
4,Good petite range,"I like gap because they have a really good, high quality range of petite clothing, and the 3-5 day shipping always tends to be quick.I do feel like the online site is missing an exchange service though - currently I need to return the item then buy it again in a different size, which is annoying when I usually tend to buy from Gap during the sales."
2,Gap Bromley High Street,"Went to Gap Bromley High Street the other day to get trousers for my son. Forgot my glasses at home and asked for help from staff. Useless and lazy. She is called Maria. It was 16:30 and she looked more interested in tied up the Shop to get home faster than to help us. I picked a size didn't fit well but where Maria was???? who knows.Went upstairs to ask for a Manager who was talking happy with another member of staff. Without even saying sorry, she said: would like me to help you? but with a body language and intonation that she didn't really meant to and off we went with an empty hand. Very poor Customer Services. I would like to apologise for forgetting my glasses at home and to bother them."
1,Gap.co.uk deserve NO stars,"Gap.co.uk deserve NO stars. The worst customer service ever. The order took 10 days to arrive, and although I returned the items immediately to Westfield London store, I'm still waiting for a refund. Unacceptable online service, will not be shopping online with them ever again."
1,I would give  -1 star  if  possible!!!!,"I would give  -1 star  if  possible!!!! Last time I've been waiting for 35 mins to reach them by phone. I've sent them 3 emails, 1 live chat, 2 phone calls  because of my refund and still nothing.... They said different things about getting my  refund, first they said I'll get my refund in 15 days but then they changed it to 25 days.IT IS VERY UNPROFESSIONAL!!!!"
5,Fantastic!,"Made a substantial order on Monday last week and the items were all delivered to my door, well packaged and quickly. In fact the whole order was at my door on Wednesday of the same week by 4pm. Will order again and they offer fantastic discounts and great customer support for customers."
3,Worn out/out of use/ancient maternity clothes. The range looks like something your grandma would buy,"I used to be really satisfied with gap until I had to look for maternity clothes. The range they have it's a joke! In my opinion and I have a feeling I am not the only one with this opinion. They have  worn out/out of use/ancient maternity clothes. I have browsed and bought maternity clothes from next, john lewis, topshop EVEN Vertbaudet(you may have not heard of them but they offer quality new age clothes) and many others. I could never wear anythig feom Gap. Those clothes look like something my grandmother would buy! Honestly guys I would give you 1 star if I would have not been satisfied with your normal range. We're in 2018, live a little and pay better designers!"
5,One of the few companies i trust to one…,One of the few companies i trust to one get my order right and two deliver when they say they would.
4,Great delivery but slow return process.,"I love GAP clothing and delivery is very prompt. However, saying that their return/ refund service is extremely slow is an understatement. I have never experience anything like it. It took almost 2 weeks to receive confirmation of returned item received. I then noticed that their email notification includes the following statement ""If you paid with a credit card, your credit should appear on your statement in one to two billing cycles"". Wow! Patience is a virtue indeed in this case.Update: The refund appeared on my statement within 2-3 working days. Given this, I am upgrading the review to 4 stars. Yes it took longer than most but have to say shipping and refund related details are accurate."
1,Awful Customer Services,"Returned an item on the 28/05, started a web chat today with a lady named Kathy S, to find out about my refund, all she could say was there's a delay in returns, so here have 10% off another order and she hopes I'll shop with them again, when I said i wouldn't shop with them again as I still haven't sorted my refund, she said ok have a nice Sunday and ended the chat. Sort this out Gap 😡"
1,Absolutely terrible service in UK Gap…,"Absolutely terrible service in UK Gap stores, Hampstead NW3 specifically.Stuff is rude, unfriendly and unprofessional.Quite a few of them  chatting on the sales floor.  Discussion personal matters and  bickering while ignoring customers - always sour facial expressions. The service used to be much better at that branch years ago."
1,Placed orders on line in 3 different…,Placed orders on line in 3 different ocassions in the last couple of months.Three times I received items that I did not order and random sizes .Disgusting.
1,ONLINE,"ONLINE - this is a review of their online store. Atrocious! Very dated and sends you to different pages you don't even click on! When I eventually got through to placing my order, and having put in my details and clicked pay, it sent me back to my orders page, this happened numerous times...so much so that I ended up cancelling my order and going else where...Joke!"
1,WORST SERVICE,"WORST SERVICE I HAVE EVER BEEN GIVE IN MY LIFE! I got to the check out when a member of staff come to eventually serve me. She started serving me with no conversation and looked frustrated. I smiled but nothing! The only words I got out of her was the price of my stuff. Then I asked for a gift box, she didn't know how to do that. Little to know I then go and find out she's the store manager! After bitting another staffs members head off for trying to kindly help she said she'll just charge me as a normal bag. Save money I did but come back, I would never! And I would never recommend it. Never go to the gap in the Trafford centre!!"
1,Shocked and disgusted!,"Shocked and disgusted!I went to the gap store (angel and islington branch) just before new years to see if there were any post christmas deals.What I arrived to at the store was absolutely disgusting and horrifying! A young pregnant lady being harassed and threatened by a member of staff!!!! I could not believe what I bore witness too, this young lady was pushed by a male member of staff and when she cried out to express her concern he then began to threaten to physically assault her! I am beyond disgusted at this behaviour and I have nothing but sympathy for this poor woman. To think a pregnant woman can not be safe to go shopping to a retail store. absolutely abysmal! Gap please vet your candidates i can't believe you hired such disgusting and callous person."
2,The low rating is due to the staff - Rude & Uncaring,"The low rating is due to the staff and not for the apparel. The staff, in general, seem to be rude, uncaring and stiff. Buying online is far better than having to interact with the staff. As everywhere, there are some exceptional staff. But in GAP, they seem to be rare."
1,Absolutely awful,"Awful. First, it takes ages for them to send the order. Second, it takes ages (2 weeks!) to confirm they have received a return. Third, it takes ages for them to actually refund your money (I'm still waiting, a week after confirmation they received the last parcel). Fourth, their sizing is terrible. I originally ordered a UK size 14, and have received instead a 10, then a 12 and then another 10 after calling customer service twice to request they send me the correct size. Needless to say, each delivery took ages to arrive. Presumably the mess up over sizes was because of the US/UK sizing differences, a UK 14 being a US 10. But that's not acceptable. I have absolutely given up on GAP."
1,Utterly dreadful dispatch times,"Utterly dreadful dispatch times. Ordered 26th November, still not shipped. Luckily I didn't pay the extra for express delivery this time, as that has still taken over a week from order in the past."
1,I'm surprised Gap is still in business,"I'm surprised Gap is still in business.  I submitted an order SEVEN days ago and it's still pending shipment.  In the interim, the cost of my order has nosedived so I just re-submitted my order for £20 less, and I'll cancel my old one.  Of course this will require me waiting for their US-based customer service hours.  Their delivery time is literally about 15x longer than anyone else I know of these days."
5,One of my favourite clothing brands.,"I've shopped with them many times and I've always been very happy! Orders to my local store arrive quickly and even if I prefer to return something that's not a problem at all, they give me a refund on the spot! One of my favourite clothing brands."
1,No money refund and very bad website,Horrible experience and I don't recommend shopping online with GAP. I decide to return part of my online order and it took them about 2 weeks to send me a return confirmation of receiving my parcel and now (2 weeks later) I'm still waiting for refund my money. The Gap t&c says it can take up 2 bank statements to appear!!! Their website also works horrible. That's shame because cloths are really nice.
1,Sent the wrong order,"I ordered a t-shirt online to collect in store. I was impressed at first as collecting in store was free and my order arrived 2 days after I placed it. However when I opened it I realised I'd been sent something completely different to what I ordered. Also their sizes must run extremely small because I'm a size 8/10, the t-shirt I was sent is an XL and fits like a glove."
1,The worst shopping experience I've ever …,"The worst shopping experience I've ever had on an online store. Completely useless, free delivery didn't work, valid promo code didn't work, live chat was useless, timed out twice. I ended up paying full price just so I could get off the site. In shock that a company of this size can produce such a shocking eCommerce experience."
3,Great products shame about the couriers,Th booking process for jeans was convienent but the courier experience with Hermes courier was terrible.Customer service was very understanding but no delivery notification of jeans at store due to a fault so I had to chase customer service to learn that my packagr arrived. Due to Hermes I would not shop online with GAP.
1,Price doubled overnight,"For many years I have been purchasing Gap's 'Pullover bra' which was an excellent purchase, priced at £14.95. Every now and again, seasonal colours were temporarily added to the range which sat alongside the standard colours they continually ran.Early this year after a long long wait without new colours, finally a new 'Light Pink' colour was introduced. Straight away this was priced at £29.95, more than double the price of the standard colours which it sat alongside, these were still priced at £14.95. I thought this was a mistake, but then a few weeks later the standard colours leapt in price overnight straight from £14.95 to £29.95!!!! and the style name changed from being called 'Pullover bra' to now being called 'Cotton bralette'.Now even if there is one of their usual '30-40% off' events, this bra will still be more expensive than the full price it was a month or so ago. How can they do this and think this is acceptable. I think this is bad and I am very disappointed the price was hiked in such a manner."
4,All good except payment service,All good except payment service. Don't understand wgy to keep freezed money and charge once more when goods deliverd
2,Sent wrong goods,"Ordered goods online as the product was not in store. Goods dispatched very quickly to store for delivery next day, but the wrong goods were dispatched. Arrived in time, but completely the wrong product."
3,Slightly disappointing first shop,"Was looking for sale items, but didn't find the website particularly user friendly in terms of easy search facilities. Delivery was fairly expensive, slow (don't expect to wait 4-5 days any more! and no tracking facility ) and when they eventually arrived the clothes were way too small for my skinny 13 year old (perhaps this was why they were in the sale?)My nearest shop is 100 miles away, so am judging purely on website experience."
4,Quality clothing that lasts years,Gap makes quality clothing that are well fitting and last ages. I have capris that I've worn to work every week spring to summer over 5yrs and are as good as new once I dyed them back again after at least 100 washes. I'd have given 5* but my local store closed & the website charges delivery & didn't provide any tracking info but my package did arrive randomly 3 days later.
4,Nice t shirts,Love the t shirts that gap provide - can always guarantee the same size & fit!
5,Baby gap clothes are a great deal!,Great value for the money specially on sales!
4,Wonderful Customer Service,"We have ordered from GAP online several times and are very happy indeed with the very helpful customer services. Lovely products, I do feel however the quality could be better, especially for the prices, compared to other brands of similar costs etc.However, all in all, lovely company and lovely designs, all good!"
4,"Good quality, washed poorly","Originally from Germany, I was always told about GAP. Then I enjoyed the variety of clothing they had, the prices at which they could be purchased, and the material. Unfortunately, they did not wash as well as I expected. I separated my sweaters accordingly. Unsure what happened!"
5,Just awesome!,"Bought a few items, workout clothes, baby clothes and all. All was delivered on time. I'd recommend the website to a friend, I've done so already actually!"
4,Good quality items.,"Customer service advisors are friendly and helpful. Excellent quality items  and consistent sizing-  but the  drawback  to ordering online is the £4 delivery charge, which, unless you are   spending £50  or more,  seems expensive, in my opinion.  Also the size xxsmall is only  available online."
3,Delivery charges,"Hi,

Just researched and apparently if you order online and wish to return the product, you should get a full refund - including delivery charges!
Not so with the Gap - I am going to stop ordering on-line, as essentially I am giving Gap money for nothing if I decide I do not like it. 
They are one of only few clothing retailers, that do not offer a free delivery or collect from store service. They often do not have all product in stores or many sizes...so I end up ordering on-line, not any more."
