Rating,Review Title,Review Text
1,Account disappeared.,Had an account for over 10 years. And now it has simply disappeared. The new website is asking me to re-register. All I wanted was my order history.Customer services have no record of me ever having an account. Absolute rubbish.
1,Ordered two pairs of trousers and they…,"Ordered two pairs of trousers and they sent a completely different item to the one I ordered. Emailed them immediately asking to rectify the error, received confirmation then nothing. Finally an email saying they were closing the query as I did not respond. To what??? Very poor."
1,Gone downhill,This was my favourite brand with hoodies and jeans fitting the best. I was ordering from GAP for 10 years or more and always knew that everything will fit and is as described. Over last year it has gone downhill. Last two times I ordered jeans they didn't fit well and also were not anything like in the picture. The description of the item - material composition was not provided too. This is the last time I ordered jeans from GAP
3,Seems very different now,"I used to buy a lot of basics from GAP, especially in the summer, but it seems very different now. The website looks just like the Next website. I don't know if it's just my imagination but the clothes look very similar too now... all very samey. There's very little product information and the photos aren't very good... sometimes there's just one photo, even just a sideways one of an arm or something. I landed up returning most of my order as it wasn't what I was expecting... very short items, almost cropped, not in the description... that kind of thing.On the plus side, the delivery was quick, as was the return and refund, although they deducted for postage.Overall, I can't imagine ordering from GAP again, which is a shame really.The other day I got an email from Joules to say Next would be managing their website and other services from now on, but not taking over exactly I don't think. I hope that doesn't go the same way."
1,AVOID - Beyond Shambolic,AVOID - Beyond Shambolic!Placed two orders to two different stores as I've gone away. Sent wrong sizes out and delivered to stores I've never been to or even listed as a delivery option. An absolute clowns outfit & not fit for purpose. The delivery company you use ‘Evri' are also grossly negligent.
5,Fabric Fabric Fabric!,"Most of the items sold in GAP have amazing natural fabric! Also, the accessible price is very attractive. All of GAP's competitors like MANGO, Zara, e.t.c have awful fabrics - cheap and synthetic. Even the higher end brands like REISS and GUESS use awful fabric for their products. Please, never change!"
1,Hopeless website,"I used to order clothes from website frequently, but now it's impossible to order anything.Couldn't sign in.  Tried password reset many times without success.  Contacted customer support, who said password reset didn't work (seriously!?)  They offered to remove my account so I could create a new one.   I took the offer.   But now can't sign in nor register!  And awful website forces one to have an account to order.I have the basket ready to order, but can't.  Guess I need to take my money elsewhere."
4,Good website and offers,"Good website and offers. Haven't returned anything in over a year so not sure about returns. However, I wish there would always be stock of the basics like the modern crew neck and v-neck tees in petite sizing (i am not that petite but norMal ones are very long). Gap is where I go for these essential basics for the entire family. Please please keep these well stocked they are better than my much more expensive tees which I will only keep until you restock. Kids clothings is also fabulous."
1,Terrible customer service experienced,"Oh my goodness I can't even begin to explain!! I used to absolutely love GAP. One of my favourite go to stores, I can't even think how much money I've spent with them over the decades. However, my recent experience of them is utterly flabbergasting - sorry for sounding OTT but wow, the worst experience in terms of not receiving items with no explanation, then reordering and only some turning up. Then being told that some items that are in the sale can take up to 42 days to ship. Yes, you read that right, 42 days!!! Inconsistent information given via their correspondence but overall terrible experience. There goes another great brand 😢😢"
1,AVOID AVOID!! DO NOT REFUND YOUR MONEY AND HOLD ONTO IT IN THEIR BANK,"GAP did a 'stop and return' item on my parcel. I have never received it in the 1st place. I am then told that they will not refund me until their courier has 1st returned it to their warehouse and then to GAP warehouse where it will take a further 5 working days to process. I had the money taken out of my account when I purchased my item, waited until delivery which did not happen and they did a 'stop and return' followed by me having to wait a further 10 WORKING DAYS  for a refund. This is a US company that normally EXCEL at customer experience but this is shocking. They just want to hold onto my money! AVOID!!!"
2,They use yodel as their courier,They use yodel as their courier. Yodel lie about attempted deliveries and say they have left a card. This has happened twice now. Customer service quick to reply but offer no real solution. I'm still trying to get my stuff 7 days after an apparent delivery attempt. Yodel are renowned for this. Stop using them gap!!!!!
5,As I have been working from home for…,"As I have been working from home for some time now, I was looking for trousers that look smart while being as comfortable as slackers are. My partner suggested Gap, and the products were exactly what I was looking for. While placing an order, I forgot to add a discount code. After contacting customer service, the code was swiftly added, before my card was charged. Overall a pleasant experience."
1,Very Bad quality,"Bought 2 cami tops in Gran Canaria GAP Store for 30€ each, after first wash you can throw it in the bin, pilling all over them! Was expecting better quality for the price I got them!"
1,Absolutely useless,"Absolutely useless. Online order form constantly tells you to enter a valid postcode, even though the postcode you use has worked on every other website on the planet, except this one. How convenient that this is happening when everything is 50%off. Don't bother wasting your time. Shop elsewhere to avoid certain disappointment."
1,TERRIBLE customer support i would…,TERRIBLE customer support i would rather not even leave 1 star - 0 would be more appropriate. Worst customer service i have come across. Avoid spending your money at Gap !
1,Terrible customer support.,"Terrible customer support.I razed a complain as I received items not matching my order. In few days I got response “as we have not heard anything more from you, we consider this to be resolved”. But I have never heard anything back on my initial query and complain. Very disappointing and even if I liked anything from their store, their arrogance will make me to buy nothing."
5,Good experience only so far,"I was really worried as I checked trustpilot after purchasing online from Gap. But I have had 4 separate orders from them so far and no problems. Quality is great. Delivery process was quick - they only send confirmation and despatch emails but there was never an email telling me that it was out for delivery, but it always gets here within the week. Got my refunds within 2 weeks of Gap receiving my return."
1,YOUR RIGHT GAP IS CRAP,"YOUR RIGHT GAP IS CRAP! Been buying my sons clothes from gap for years, not anymore! Placed online order, got email saying order didn't go through so re done order. Got the order, turns out was charged twice unknowingly missing items, American call center clueless unwilling to help always saying call back later!! No refund for missing items! Thanks gap and goodbye! Buy British!"
4,Surprisingly quick,"Worried about ordering from Gap after reading some of the reviews but I decided to test it on something cheap because I miss the shop and need summer clothes. Chose standard delivery on Friday night, item came today (Monday). No need to pay extra for next day delivery because this was speedy enough. Have now placed another order. The only problem is the tshirt I ordered was slightly different to the picture, but no big deal - still looks fine. Also sometimes the sizing can be inconsistent in Gap so there's certain things I won't be ordering until I can get to a Gap store to return things. Otherwise, all good."
1,What did Next do to Gap,"What did Next do to Gap! seriously I always placed large orders for my family, my young son loves their clothes,  I loved their Jeans but  no short leg anymore and a handful to choose from. I always loved an offer which gap always ran sadly no more. This is so so disappointing as I was actually excited that Next were taking it on so I could have collect from store, well I won't be collecting anything anymore. Ruined a great website."
5,I could not recommend GAP enough,I could not recommend GAP enough. I don't have much experience online but customer service in shops is brilliant. Staff cannot help you enough. I have been shopping there for years now and they delivered every time. Good value for money specialy arround sales 😊 Thank you 😊 Shop we always look forward to!
5,Great online service …,"I love the gap clothes for children it's long lasting,washes great and my kids actually want to wear them !!! This is the first time I've done an online order since the shops shut but I was so impressed. Ordered Monday (Bank holiday) and it was delivered Friday morning. You recieve a return label if you need to return. Still the same great quality and quick delivery!!!"
3,Teething troubles or badly run?,"Teething troubles or badly run? This has not been a good experience of the new online Gap.I was sent a tracking number that is not recognised by the system. Tried the online chat: not working at this time. Not working in the middle of the afternoon. Just tried phoning: ""due to an ongoing emergency (we don't actually employ people - maybe?) we are unable to take your call,  goodbye"".Sent an email. Nothing in response.After posting a more critical version of this review I received an email with a new tracking number that did lead to Hermes (if this is the preferred courier of Gap it suggests they're running the business on a shoe string - Hermes are more likely to be cheap than reliable). Hope in future they give a courier option..."
5,Fast delivery and high quality,Made different online orders at Gap.co.uk and I can definitely say that they were the fastest deliveries ever! Ordered Sunday night and received Tuesday morning.The quality of the clothes is very high. Returned some items for wrong size and receveid the refund in few days
5,Brilliant service,"I placed an on-line order with Gap before reading the reviews on Trustpilot.  I must admit I was worried by the bad reports. Fortunately my experience of their service was excellent.  I placed my order on Monday 25th July, I received my order on Wednesday 27th July, I returned the unwanted items on Thursday 28th July, I had an email confirming that GAP had received my returns on Tuesday 2nd Aug and the refund was in my account today 4th Aug.  Brilliant service (or perhaps I was just lucky) anyway really pleased."
5,New GAP in Manchester arndale centre,"The new GAP store in Manchester Arndale centre is fabulous and it's being run really well by the manager Sarah, who is very active and helpful on the shop floor and even introduced herself when I spoke to her upon arrival as I'd already spoken to her on the telephone when she put the items I wanted to one side.  Also Iymaan on the tills was an absolute delight and the perfect personality for that role, making sure everyone was happy. All in all, there seems to be a great team of women there."
1,Wrong Size item sent out twice.,Ordered on line as no stores close by. The wrong size item was sent out twice. Once is forgivable but not twice.  I won't use them again. It's a shame as I ordered based on a previous purchase.
1,"Order still ""pending"" after 5 days","Order still ""pending"" after 5 days, customer service offer nothing but apologise , well apologise doth butter no parsnips ! I expected far better service from a global brand as GAP, Terrible service. Will also give feedback on Trustpilot . If you took as much time on fulfilling orders as you do on sending daily spam advertising then maybe you would get your orders out on time and in the timescale promised ! little wonder why if this is their level of standards and customer care why all their UK stores were closed !"
1,I bought online items and got delivered…,"I bought online items and got delivered to Ireland. But I could not return them. Gap stores in blanchardstown refused to refund. Online options were as follows.1. Royal mail... AnPost didn't accept it.2. Collect+ ... no collect plus in Ireland. And their so called partners ""PARCELMOTEL"" had no such option when I made an account.3. I contacted customer service but they could not help. bunch of stupid people I encountered today. Such a bad experience for buying on GAP sebsite"
2,Jeans aren't as advertised,"I ordered some jeans that were advertised as being stretch jeans. When they arrived, they were not stretchy at all.  I returned them and ordered a different pair... then they arrived and yet again they weren't stretchy, so had to return them too. Customer service said they would change the wording on the website  but they still haven't done so. Have given 2 stars rather than 1 as at least customer service replied in good time.Very few sizes available on website."
1,Absolute garbage,"Absolute garbage. I used to shop at gap all the time, they had trendy styles which were good quality at affordable prices.I think next have taken over to run it in the ground.Terrible styles, terrible customer service all at a higher price.Thry wont be seeing another penny from me."
1,They lost my order.,They lost my order..  didnt email me so I had to track down the items I'd paid for and never recieved. To add insult as an apology they offered me the promo code that they offer all customers on the website. When I pointed this out they apologised that I wasnt satisfied with my experience... really poor customer service. Theres too many brands now with equal products and much better customer service for Gap to treat their loyal customers so poorly.
1,Gap should be called Crap,"Ordered a birthday present online, the day of delivery (less than an hour before delivery) I get an email to say that part of the order isn't included, and with absolutely no chance f being able to get something else in time. Off course Crap had no problem in taking the money off me straight away if only their customer service team could operate as quickly as the collections team.DON'T ORDER FROM GAP!!!!!!#GapAreCrap"
1,delivery dates are all lies,"checked on my order as it seemed to be taking longer than it should. Customer Services told me it would be 10 business days and it had not been despatched as yet. My email confirmation clearly stated 4-7 business days, but they said it was the holidays and the order could not be amended.Happy enough to take your money for an expedited delivery, but won't honour the contract when it comes to standard delivery.Be wary if you are ordering for xmas as the delivery dates advertised are all lies."
1,To continue from yesterday,"To continue from yesterday, so glass came in for window only to be wrong again, it really is so hard for them to get an order correct.Took our installer so long just to get this far, GAP Plastics are a pathetic excuse for a company.Come on GAP make this right, show that if you really make an effort you can deliver right on the goods ordered."
1,Do not,"Do not, do not, do not buy a merino jumper from gap unless you want to buy incredibly expensive loo roll. Gap's jumpers literally could not be thinner or more transparent if they were spun by imprisoned elves out of gossamer. What a rip-off."
1,New website is absolutely terrible…,New website is absolutely terrible since it launched a few days ago.  Literally cannot order anything on there.  It also said that discounts are just as good as before but that's a lie.  There are no extra 50% off sale price prices and there are no additional 10-30% discount  of sale prices either.  The old model worked so well and I could pick up brilliant bargains for around £1-2.  Now the minimum price you'll find is £4.  Being back the old gap!!
1,Shockingly poor service,"Spent over the threshold for free delivery, yet I was nonetheless charged for delivery. Separately, I went to store on my birthday to claim 50% birthday discount. Store assistant said the discount would not go through as the app hadn't sent me a message code(?) despite the fact I'd registered months ago with all my correct details. Contacted Gap via phone, email & letter, but have received no contact whatsoever and it's now 5 months later.Would not expect this from an expensive, well-established brand like GAP.Very disappointed."
1,What a pointless company,What a pointless company. The website is still as useless as it ever was and the stock levels are a joke. Anyway managed to find three things to buy. Got a message saying delivery was attempted. This was a lie I was sat next to the door at the time they allegedly visited.To avoid this happening again I arranged for the supposed re-deliveryTo go to a locker. A week later still no update on delivery process. You can't contact their abysmal courier. A complete waste of time and effort.
5,EXCELLENT SERVICE,"I'm afraid I have to disagree, with some of the other comments.  I placed an order for my granddaughters birthday… arrived on time but unfortunately was a bit tight on her hips. I returned it within  a few days of receipt and received an email from Gap 29/9 to acknowledge receipt of my return. The funds were back in my account 30/9…."
1,Forced to buy online due to stores…,"Forced to buy online due to stores closures, had to return products and being told might have to wait 30 days for a refund - of course they feel that quoting the Coronavirus etc etc makes this acceptable. Why then doesn't it state this on their website! In the current climate you need to be encouraging people to spend money with you gap not treating your customers badly."
1,"Didn't deliver, didn't care","Spent hours selecting £200 of clothes. Got a dispatch notification. Never received any clothes. Next I hear of it, I get a refund notification. Speak to live chat, get told 🤷 courier couldn't deliver. What a load of rubbish - I live in the middle of the city. They seriously think I'm going to order again, no chance. What a waste of my time."
2,How to make things very complicated! Terrible refund policy,"How to make things very complicated! One order with 3 items. Shipped separate by 2 different couriers (1 Hermes & 1 Yodel) original full charge refunded and charged separate for each delivery, refunded again and charged again. Upon return easy enough to take to the post office but now waiting for a refund and told have to wait up to 2 billing cycles - that can be over 2 months from when they get it back. All in all they had my money for about 7 weeks and still awaiting a refund. There should be a time limit imposed on companies like this for a 5 day window to send the money back - not over 60 days! Very poor and won't be ordering online again - Mind the gap!"
1,I agree totally with the previous…,I agree totally with the previous reviewer.    MUCH more expensive.   Less bargains.   Less choice.    What a disappointment and a missed opportunity as I was looking forward to see what it would bring.   All the physical shops closed.   The sister brand Banana Republic also axed.  Will be very surprised if Gap are still trading in a years time in the UK.  It used to be quite an iconic brand.   I loved the quality of the shirts and chinos etc.   Very sad.
1,Gap's poor website and new styling,"When Next took over Gap's website, I knew that would be the last I purchased from Gap despite being a huge buyer of gap clothes for my two boys before. I find their website to be identical to the Next one, which I already hated but I also find their new clothing styling to be as bland as Next's. It's a big no from me unfortunately and I will no longer buy product from Gap"
5,I Can't Fault Them,"I have ordered from Gap a lot over the past couple of years and have never had a problem. I am always impressed by the quality of their clothes. I buy for my children and grandchildren and the clothes are lovely, especially the childrens. The last order I placed recently was for a winter coat for my daughter. The delivery time given was as over a week as I picked the cheapest option. You can imagine how pleased I was when Hermes delivered the next day!"
1,Ignored emails. Stolen product.,"Sent a faulty item back in July/August. Customer Services were very helpful and promised me a gift voucher in return. THREE months later, countless emails sent chasing and no vouchers or response to my emails! They have basically stolen my product! DISGUSTING."
2,Website not functional,"Tried to order an item, couldn't get through to completed order page. Customer chat very polite but couldn't help with order. Now the order has gone through four times and they are attempting to cancel. Website doesn't seem to function properly and now I may have paid out four times."
1,Violently slow refund times,"Purchased a pair of shorts, took all the tags off, only go realise that there was a gaping hole in the pocket area where the stitching had seemingly been missed! Sent pictures in to customer service and was asked to return the item. Took several weeks to receive a reply, where I was told that the item did not meet GAPs 'return policy guidelines' but they would process a refund out of 'courtesy'. However, I am told that I will have to wait 1-2 billing cycles to receive this refund! Absolute shambles. For a big company, you'd expect so much better."
1,Crap Gap,"The company I work for use gap groups daily/weekly without fail. The equipment is NEVER delivered on time, always excuse of driver knock or wagon problems. Equipment is substandard so I would Advise anyone that hires to give tools a real good check or you could be charged for damages."
1,What is it about GAP and sizing....,"Review by my wife....What is it about GAP and sizing..? Buying from their shops is bad enough, with US and European sizing and no UK equivalent. Now having made the mistake of buying some dungarees online because UK sizing is actually given I find that a size 8 is actually about a size 12 and a size 10 would fit my husband (they don't suit him though)! Correct and consistent sizing should be a 'no brainer', their crazy system must be costing them a fortune in return postage and extra work.I now have to hope I can get a refund, looking at other comments here it seems there might be more hassle to come!AVOID...."
5,"GAP at the Trafford Centre, place to shop for excellent customer care.","GAP at the Trafford Centre was great! The lady on the shop floor - Alison, went above and beyond helping my daughter choose the right jeans. Even when the sale was nearly completed, she went out of her way to tell us about the app and the amazing saving - thank you so much, you not only did your job - you excelled and did it all with a smile!"
1,"My first order, I shale not bother again.","My first order and I received from the neighbour… The address printed on the parcel delivered by Yodel was so small and unclear, they had delivered to the wrong address. I ordered a boys dressing gown which was really poor quality. Shocking considering the price on top of delivery! I usually order from M&S but they were out of stock,The Next store should have been my next choice of place to shop."
5,Very happy.,"I purchased 7 pairs of jeans, 3 sweatshirts and a jacket, and they all were top notch. The delivery took 4 days, in which the dispatch process took 3 (the delivery way 24 hours). I disliked only one pair of jeans and decided to send them back. They included prepaid postage (Royal Mail 48 and Yodel) stickers in the parcel, which surprised me. I just packed the jeans, put on the sticker and sent it back. I did not need to message them or call. The instructions of return were clear. Put the item, put the sticker on the parcel and send it back. I received a refund after just 7 days. Very, very pleased with them. I don't understand how people could have such negative experience."
1,No customer service available,"Placed an order though their website. Order got lost in the Evri system (as usual). 5 e-mails later and 5 cals to the useless CS number which cutts off whichever option you choose there was no way to get in touch with them. Finally posted an ugly comment on their FB page which finally made them get back to me, only to be given a US number on which to re-order my lost items. Complete BS of a company and customer service. Never again will I use their service!"
1,Gap's mens sizes are guess work!,"Dear all....enjoy trying to navigate Gap size guides which seem only to exist for women's clothing! Irrespective of how you try to access a size guide for men's clothing, it does not work! Shame and dk how you expect to sell clothes online if you cannot assess the correct size! Thought Gap was an iconic brand of quality...must not be that keen to sell."
